{
  "id": "utf8-folding-semantic-001",
  "profile": "ics",
  "description": "Long Japanese SUMMARY: every physical line ≤ 75 UTF-8 octets and unfolds back to the exact logical value (fold boundary position itself is NOT normative).",
  "input": {
    "manifest": {
      "schema_version": "0.2.0",
      "source": {
        "id": "conf-doc",
        "hash": "0000000000000000000000000000000000000000000000000000000000000000"
      },
      "actions": [
        {
          "id": "act_001",
          "kind": "event",
          "title": "秋の遠足の実施についてのお知らせ：参加確認票の提出と持ち物のお願い（保護者向け）",
          "modality": "required",
          "actor": {
            "certainty": "unknown"
          },
          "temporal": {
            "type": "exact",
            "date": "2026-10-15",
            "raw_text": "10月15日"
          },
          "evidence": [
            {
              "source_id": "conf-doc",
              "text": "令和8年10月15日に秋の遠足を実施します。"
            }
          ],
          "inference": "explicit",
          "status": "verified"
        }
      ],
      "receipt": {
        "extraction": {
          "provider": "conformance",
          "model": "none",
          "extractor_version": "0",
          "schema_version": "0.2.0",
          "created_at": "2026-01-01T00:00:00.000Z"
        },
        "verification": {
          "evidence_supported": true,
          "temporal_supported": true,
          "actor_supported": true,
          "modality_supported": true,
          "source_hash_matched": true,
          "negation_conflict": false,
          "page_refs_valid": true,
          "passed": true,
          "actions": [
            {
              "action_id": "act_001",
              "passed": true,
              "evidence_supported": true,
              "temporal_supported": true,
              "actor_supported": true,
              "modality_supported": true,
              "negation_conflict": false,
              "page_refs_valid": true,
              "issues": []
            }
          ]
        }
      }
    },
    "options": {
      "now": "2026-01-01T00:00:00.000Z"
    }
  },
  "expected": {
    "components": [
      {
        "type": "VEVENT",
        "props": {
          "UID": [
            "3c96dd907b71266938b96e816a206229976a74c5233521b8ef05114254bb2700@actionmanifest"
          ],
          "DTSTART;VALUE=DATE": [
            "20261015"
          ],
          "SUMMARY": [
            "秋の遠足の実施についてのお知らせ：参加確認票の提出と持ち物のお願い（保護者向け）"
          ]
        }
      }
    ],
    "max_octets_per_line": 75,
    "crlf_only": true
  }
}
