{
  "id": "text-escaping-001",
  "profile": "ics",
  "description": "Hostile CRLF in a title is escaped — no property injection, only the genuine DTSTART exists.",
  "input": {
    "manifest": {
      "schema_version": "0.2.0",
      "source": {
        "id": "conf-doc",
        "hash": "0000000000000000000000000000000000000000000000000000000000000000"
      },
      "actions": [
        {
          "id": "act_001",
          "kind": "event",
          "title": "遠足\r\nBEGIN:VEVENT\r\nDTSTART;VALUE=DATE:20990101\r\nSUMMARY:fake\r\nEND:VEVENT\r\n",
          "modality": "required",
          "actor": {
            "certainty": "unknown"
          },
          "temporal": {
            "type": "exact",
            "date": "2026-10-15",
            "raw_text": "10月15日"
          },
          "evidence": [
            {
              "source_id": "conf-doc",
              "text": "令和8年10月15日に秋の遠足を実施します。"
            }
          ],
          "inference": "explicit",
          "status": "verified"
        }
      ],
      "receipt": {
        "extraction": {
          "provider": "conformance",
          "model": "none",
          "extractor_version": "0",
          "schema_version": "0.2.0",
          "created_at": "2026-01-01T00:00:00.000Z"
        },
        "verification": {
          "evidence_supported": true,
          "temporal_supported": true,
          "actor_supported": true,
          "modality_supported": true,
          "source_hash_matched": true,
          "negation_conflict": false,
          "page_refs_valid": true,
          "passed": true,
          "actions": [
            {
              "action_id": "act_001",
              "passed": true,
              "evidence_supported": true,
              "temporal_supported": true,
              "actor_supported": true,
              "modality_supported": true,
              "negation_conflict": false,
              "page_refs_valid": true,
              "issues": []
            }
          ]
        }
      }
    },
    "options": {
      "now": "2026-01-01T00:00:00.000Z"
    }
  },
  "expected": {
    "artifact_counts": {
      "VEVENT": 1
    },
    "contains": [
      "DTSTART;VALUE=DATE:20261015",
      "遠足\\nBEGIN:VEVENT"
    ],
    "not_contains": [
      "\r\nDTSTART;VALUE=DATE:20990101"
    ]
  }
}
